{
    "policyResultVersion": "0.1",
    "policyRef": {
        "policyVersion": "pol-0.1.3",
        "policyHash": "0x9a8b7c6d5e4f00112233445566778899aabbccddeeff00112233445566778899"
    },
    "intentHash": "0x<INTENT_HASH_PLACEHOLDER>",
    "solutionId": "0xbbbbbbbbbbbbbbbbbbbbbbbbbbbbbbbbbbbbbbbbbbbbbbbbbbbbbbbbbbbbbbbb",
    "status": "PASS",
    "findings": [
        {
            "ruleId": "R0_BASIC_VALIDATION",
            "severity": "INFO",
            "message": "Basic intent and solution structure is valid."
        },
        {
            "ruleId": "R3_QUOTE_VALIDITY",
            "severity": "INFO",
            "message": "Quote is valid and meets minimum output requirement."
        }
    ],
    "riskTags": [
        "TOKEN_TRANSFER",
        "APPROVAL_CHANGE"
    ],
    "summary": [
        "Swap will exchange 1000 USDC for >= 0.25 WETH.",
        "Expected output is 0.251 WETH.",
        "No unsafe contract interactions detected."
    ],
    "evidenceRefs": [
        {
            "type": "simulation",
            "value": "sim-abc-123"
        }
    ],
    "executionDiff": {
        "tokenChanges": [
            {
                "account": "0x1111111111111111111111111111111111111111",
                "token": "0xA0b86991c6218b36c1d19d4a2e9eb0ce3606eb48",
                "delta": "-1000000000"
            },
            {
                "account": "0x1111111111111111111111111111111111111111",
                "token": "0xC02aaA39b223FE8D0A0E5C4F27eAD9083C756Cc2",
                "delta": "251000000000000000"
            }
        ],
        "allowanceChanges": [],
        "safeConfigChanged": false
    },
    "timestamp": 1777777000,
    "signature": {
        "type": "POLICY_SERVER",
        "signer": "0xPolicyServiceAddress",
        "sig": "0x<POLICY_SIGNATURE_PLACEHOLDER>"
    }
}
